{
  "schema_version": "1.0",
  "model_id": "qwen3-8b-q4",
  "model_family": "qwen3",
  "model_version": "3-8b",
  "artifact_digest": null,
  "runtime": "ollama",
  "runtime_version": "0.11.10",
  "runtime_model": "qwen3:8b-q4_K_M",
  "quantization": "Q4_K_M",
  "role": "semantic-interpreter",
  "capabilities": ["structured-extraction", "classification"],
  "supported_input_contracts": ["local-inference/1.0"],
  "supported_output_contracts": ["semantic-proposal/1.0"],
  "structured_output_support": true,
  "context_limit": 4096,
  "resources": {"cpu": true, "gpu": "optional"},
  "prompt_version": "semantic-proposal-v1",
  "template_digest": null,
  "qualification_suite": "semantic-proposal-v1",
  "qualification_status": "unqualified",
  "lifecycle": "candidate",
  "provenance": {"source": "https://ollama.com/library/qwen3:8b-q4_K_M", "revision": null}
}
